id,original_title,release_date,poster_path,overview,title,popularity,vote_average,vote_count
335984,Blade Runner 2049,2017-10-04,/gajva2L0rPYkEWjzgFlBXCAVBE5.jpg,"A new blade runner uncovers a secret that threatens the future of humanity.",Blade Runner 2049,19.0031,7.6,14658
1895,Star Wars: Episode III - Revenge of the Sith,2005-05-17,/xfSAoBEm9MNBjmlNcDYLvLSMlnq.jpg,"Anakin Skywalker is seduced by the dark side as the Republic falls and the Empire rises.",Star Wars: Episode III - Revenge of the Sith,9.4547,7.456,14565
12155,Alice in Wonderland,2010-03-03,/o0kre9wRCZz3jjSjaru7QU0UtFz.jpg,"Alice returns to Wonderland and fulfills her destiny against the Red Queen.",Alice in Wonderland,13.3305,6.636,14540
324786,Hacksaw Ridge,2016-10-07,/wuz8TjCIWR2EVVMuEfBnQ1vuGS3.jpg,"WWII medic Desmond Doss saves lives on the battlefield without carrying a weapon.",Hacksaw Ridge,12.929,8.192,14511
10528,Sherlock Holmes,2009-12-23,/zz0vClg5NdYbhpqaEGyJENrGVSw.jpg,"Detective Sherlock Holmes unravels a deadly conspiracy threatening England.",Sherlock Holmes,7.6986,7.216,14507
466272,Once Upon a Time... in Hollywood,2019-07-24,/8j58iEBw9pOXFD2L0nt0ZXeHviB.jpg,"An actor and his stunt double navigate a changing Hollywood in 1969.",Once Upon a Time... in Hollywood,12.9523,7.425,14409
1271,300,2007-03-07,/h7Lcio0c9ohxPhSZg42eTlKIVVY.jpg,"King Leonidas leads 300 Spartans against the Persian army.",300,9.1285,7.192,14397
438631,Dune,2021-09-15,/d5NXSklXo0qyIYkgV94XAgMIckC.jpg,"Paul Atreides journeys to Arrakis, the most dangerous planet in the universe.",Dune,23.0482,7.776,14282
353486,Jumanji: Welcome to the Jungle,2017-12-09,/pSgXKPU5h6U89ipF7HBYajvYt7j.jpg,"Teenagers are transported into a dangerous video game world.",Jumanji: Welcome to the Jungle,8.2669,6.819,14203
8966,Twilight,2008-11-20,/3Gkb6jm6962ADUPaCBqzz9CTbn9.jpg,"A teenage girl falls in love with a vampire in a small town.",Twilight,17.4084,6.283,14155
1894,Star Wars: Episode II - Attack of the Clones,2002-05-15,/oZNPzxqM2s5DyVWab09NTQScDQt.jpg,"Jedi investigate an assassination attempt as the Clone Wars begin.",Star Wars: Episode II - Attack of the Clones,7.717,6.586,14004
12445,Harry Potter and the Deathly Hallows: Part 2,2011-07-12,/c54HpQmuwXjHq2C9wmoACjxoom3.jpg,"Harry, Ron and Hermione make a final stand against Voldemort as the wizarding world faces its darkest hour.",Harry Potter and the Deathly Hallows: Part 2,19.8279,8.083,21561
634649,Spider-Man: No Way Home,2021-12-15,/1g0dhYtq4irTY1GPXvft6k4YLjm.jpg,"Peter Parker seeks Doctor Strange’s help after his identity is revealed, opening the multiverse.",Spider-Man: No Way Home,25.9866,7.935,21426
14160,Up,2009-05-28,/mFvoEwSfLqbcWwFsDjQebn9bzFe.jpg,"Widower Carl Fredricksen fulfills his dream of adventure by lifting his house into the sky.",Up,16.3274,7.96,21208
135397,Jurassic World,2015-06-06,/rhr4y79GpxQF9IsfJItRXVaoGs4.jpg,"A fully operational dinosaur theme park descends into chaos when a new attraction escapes.",Jurassic World,12.9374,6.701,21204
297762,Wonder Woman,2017-05-30,/v4ncgZjG2Zu8ZW5al1vIZTsSjqX.jpg,"Amazon princess Diana leaves her home to stop a devastating global conflict.",Wonder Woman,15.7517,7.212,20623
354912,Coco,2017-10-27,/6Ryitt95xrO8KXuqRGm1fUuNwqF.jpg,"Young Miguel journeys through the Land of the Dead to discover his family’s true legacy.",Coco,16.8384,8.2,20544
102899,Ant-Man,2015-07-14,/rQRnQfUl3kfp78nCWq8Ks04vnq1.jpg,"Scott Lang becomes Ant-Man and must pull off a heist to save the world.",Ant-Man,9.8442,7.067,20522
675,Harry Potter and the Order of the Phoenix,2007-07-08,/5aOyriWkPec0zUDxmHFP9qMmBaj.jpg,"Harry forms Dumbledore’s Army as Voldemort’s return is denied by the Ministry.",Harry Potter and the Order of the Phoenix,19.8114,7.674,20412
767,Harry Potter and the Half-Blood Prince,2009-07-15,/z7uo9zmQdQwU5ZJHFpv2Upl30i1.jpg,"Dumbledore prepares Harry for the final battle as Voldemort’s power grows.",Harry Potter and the Half-Blood Prince,25.0527,7.682,20384
245891,John Wick,2014-10-22,/fZPSd91yGE9fCcCe6OoQr6E3Bev.jpg,"Legendary hitman John Wick seeks vengeance after losing everything he loved.",John Wick,9.1121,7.454,20329
557,Spider-Man,2002-05-01,/kjdJntyBeEvqm9w97QGBdxPptzj.jpg,"Teenager Peter Parker gains extraordinary powers and becomes Spider-Man.",Spider-Man,18.775,7.318,20168
263115,Logan,2017-02-28,/fnbjcRDYn6YviCcePDnGdyAkYsB.jpg,"An aging Wolverine protects a young mutant in a violent and unforgiving future.",Logan,12.5397,7.819,20039
12444,Harry Potter and the Deathly Hallows: Part 1,2010-11-17,/iGoXIpQb7Pot00EEdwpwPajheZ5.jpg,"Harry, Ron and Hermione hunt Horcruxes while the wizarding world falls into darkness.",Harry Potter and the Deathly Hallows: Part 1,19.5977,7.737,19981
346364,It,2017-09-06,/9E2y5Q7WlCVNEhP5GiVTjhEhx1o.jpg,"A group of children confront a terrifying entity lurking beneath their town.",It,28.3415,7.239,19972
10681,WALL·E,2008-06-22,/hbhFnRzzg6ZDmm8YAmxBnQpQIPh.jpg,"A lonely robot sparks hope for humanity’s future after Earth is abandoned.",WALL·E,17.7977,8.106,19787
210577,Gone Girl,2014-10-01,/ts996lKsxvjkO2yiYG0ht4qAicO.jpg,"A man becomes the prime suspect when his wife mysteriously disappears.",Gone Girl,14.7529,7.889,19528